{
  "capabilityId": "baby-quirt-universal-github-authority",
  "capabilityVersion": "1.0.0",
  "checkpoint": "A",
  "supportState": "contract_only",
  "publicTool": "call_quirt",
  "publicArguments": [
    "operation",
    "payload",
    "idempotencyKey"
  ],
  "modelSchemas": {
    "GitRepositoryIdentity": {
      "type": "object",
      "additionalProperties": false,
      "properties": {
        "repositoryId": {
          "type": "string",
          "pattern": "^[A-Za-z0-9][A-Za-z0-9._:-]{0,255}$"
        },
        "canonicalRemote": {
          "type": "string",
          "minLength": 1,
          "maxLength": 4096
        },
        "host": {
          "type": "string",
          "minLength": 1,
          "maxLength": 4096
        },
        "owner": {
          "type": "string",
          "minLength": 1,
          "maxLength": 4096
        },
        "name": {
          "type": "string",
          "minLength": 1,
          "maxLength": 4096
        },
        "numericRepositoryId": {
          "type": "integer",
          "minimum": 0
        }
      },
      "required": [
        "repositoryId",
        "canonicalRemote",
        "host",
        "owner",
        "name"
      ]
    },
    "GitSourceIdentity": {
      "type": "object",
      "additionalProperties": false,
      "properties": {
        "repository": {
          "type": "object",
          "additionalProperties": false,
          "properties": {
            "repositoryId": {
              "type": "string",
              "pattern": "^[A-Za-z0-9][A-Za-z0-9._:-]{0,255}$"
            },
            "canonicalRemote": {
              "type": "string",
              "minLength": 1,
              "maxLength": 4096
            },
            "host": {
              "type": "string",
              "minLength": 1,
              "maxLength": 4096
            },
            "owner": {
              "type": "string",
              "minLength": 1,
              "maxLength": 4096
            },
            "name": {
              "type": "string",
              "minLength": 1,
              "maxLength": 4096
            },
            "numericRepositoryId": {
              "type": "integer",
              "minimum": 0
            }
          },
          "required": [
            "repositoryId",
            "canonicalRemote",
            "host",
            "owner",
            "name"
          ]
        },
        "ref": {
          "type": "string",
          "minLength": 1,
          "maxLength": 4096
        },
        "commit": {
          "type": "string",
          "pattern": "^[a-f0-9]{40}$"
        },
        "tree": {
          "type": "string",
          "pattern": "^[a-f0-9]{40}$"
        },
        "parents": {
          "type": "array",
          "items": {
            "type": "string",
            "pattern": "^[a-f0-9]{40}$"
          }
        }
      },
      "required": [
        "repository",
        "commit",
        "tree",
        "parents"
      ]
    },
    "GitCredentialReference": {
      "type": "object",
      "additionalProperties": false,
      "properties": {
        "credentialReferenceId": {
          "type": "string",
          "pattern": "^[A-Za-z0-9][A-Za-z0-9._:-]{0,255}$"
        },
        "credentialType": {
          "enum": [
            "ssh_deploy_key",
            "github_app_installation",
            "fine_grained_token",
            "commit_signing"
          ]
        },
        "provider": {
          "enum": [
            "git",
            "github"
          ]
        },
        "accountOrInstallationId": {
          "type": "string",
          "pattern": "^[A-Za-z0-9][A-Za-z0-9._:-]{0,255}$"
        },
        "repositoryAuthorityId": {
          "type": "string",
          "pattern": "^[A-Za-z0-9][A-Za-z0-9._:-]{0,255}$"
        },
        "allowedOperationFamilies": {
          "type": "array",
          "items": {
            "type": "string",
            "minLength": 1,
            "maxLength": 4096
          }
        },
        "permissionSnapshotDigest": {
          "type": "string",
          "pattern": "^[a-f0-9]{64}$"
        },
        "expiresAt": {
          "type": "string",
          "format": "date-time"
        },
        "revoked": {
          "type": "boolean"
        },
        "health": {
          "enum": [
            "healthy",
            "degraded",
            "unavailable",
            "unknown"
          ]
        }
      },
      "required": [
        "credentialReferenceId",
        "credentialType",
        "provider",
        "accountOrInstallationId",
        "repositoryAuthorityId",
        "allowedOperationFamilies",
        "permissionSnapshotDigest",
        "revoked",
        "health"
      ]
    },
    "GitWorkspaceIdentity": {
      "type": "object",
      "additionalProperties": false,
      "properties": {
        "workspaceId": {
          "type": "string",
          "pattern": "^[A-Za-z0-9][A-Za-z0-9._:-]{0,255}$"
        },
        "repositoryId": {
          "type": "string",
          "pattern": "^[A-Za-z0-9][A-Za-z0-9._:-]{0,255}$"
        },
        "mirrorPath": {
          "type": "string",
          "minLength": 1,
          "maxLength": 4096
        },
        "worktreePath": {
          "type": "string",
          "minLength": 1,
          "maxLength": 4096
        },
        "branch": {
          "type": "string",
          "minLength": 1,
          "maxLength": 4096
        },
        "head": {
          "type": "string",
          "pattern": "^[a-f0-9]{40}$"
        },
        "tree": {
          "type": "string",
          "pattern": "^[a-f0-9]{40}$"
        },
        "clean": {
          "type": "boolean"
        }
      },
      "required": [
        "workspaceId",
        "repositoryId",
        "mirrorPath",
        "worktreePath",
        "head",
        "tree",
        "clean"
      ]
    },
    "GitRefExpectation": {
      "type": "object",
      "additionalProperties": false,
      "properties": {
        "remote": {
          "type": "string",
          "minLength": 1,
          "maxLength": 4096
        },
        "destinationRef": {
          "type": "string",
          "minLength": 1,
          "maxLength": 4096
        },
        "expectedOldObject": {
          "type": "string",
          "pattern": "^[a-f0-9]{40}$"
        },
        "newObject": {
          "type": "string",
          "pattern": "^[a-f0-9]{40}$"
        },
        "newTree": {
          "type": "string",
          "pattern": "^[a-f0-9]{40}$"
        },
        "fastForwardOnly": {
          "const": true
        }
      },
      "required": [
        "remote",
        "destinationRef",
        "newObject",
        "newTree",
        "fastForwardOnly"
      ]
    },
    "GitPushPlan": {
      "type": "object",
      "additionalProperties": false,
      "properties": {
        "planId": {
          "type": "string",
          "pattern": "^[A-Za-z0-9][A-Za-z0-9._:-]{0,255}$"
        },
        "planDigest": {
          "type": "string",
          "pattern": "^[a-f0-9]{64}$"
        },
        "principal": {
          "type": "string",
          "pattern": "^[A-Za-z0-9][A-Za-z0-9._:-]{0,255}$"
        },
        "repositoryAuthorityId": {
          "type": "string",
          "pattern": "^[A-Za-z0-9][A-Za-z0-9._:-]{0,255}$"
        },
        "workspace": {
          "type": "object",
          "additionalProperties": false,
          "properties": {
            "workspaceId": {
              "type": "string",
              "pattern": "^[A-Za-z0-9][A-Za-z0-9._:-]{0,255}$"
            },
            "repositoryId": {
              "type": "string",
              "pattern": "^[A-Za-z0-9][A-Za-z0-9._:-]{0,255}$"
            },
            "mirrorPath": {
              "type": "string",
              "minLength": 1,
              "maxLength": 4096
            },
            "worktreePath": {
              "type": "string",
              "minLength": 1,
              "maxLength": 4096
            },
            "branch": {
              "type": "string",
              "minLength": 1,
              "maxLength": 4096
            },
            "head": {
              "type": "string",
              "pattern": "^[a-f0-9]{40}$"
            },
            "tree": {
              "type": "string",
              "pattern": "^[a-f0-9]{40}$"
            },
            "clean": {
              "type": "boolean"
            }
          },
          "required": [
            "workspaceId",
            "repositoryId",
            "mirrorPath",
            "worktreePath",
            "head",
            "tree",
            "clean"
          ]
        },
        "credentialReferenceId": {
          "type": "string",
          "pattern": "^[A-Za-z0-9][A-Za-z0-9._:-]{0,255}$"
        },
        "sourceRef": {
          "type": "string",
          "minLength": 1,
          "maxLength": 4096
        },
        "expectation": {
          "type": "object",
          "additionalProperties": false,
          "properties": {
            "remote": {
              "type": "string",
              "minLength": 1,
              "maxLength": 4096
            },
            "destinationRef": {
              "type": "string",
              "minLength": 1,
              "maxLength": 4096
            },
            "expectedOldObject": {
              "type": "string",
              "pattern": "^[a-f0-9]{40}$"
            },
            "newObject": {
              "type": "string",
              "pattern": "^[a-f0-9]{40}$"
            },
            "newTree": {
              "type": "string",
              "pattern": "^[a-f0-9]{40}$"
            },
            "fastForwardOnly": {
              "const": true
            }
          },
          "required": [
            "remote",
            "destinationRef",
            "newObject",
            "newTree",
            "fastForwardOnly"
          ]
        },
        "mergeBase": {
          "type": "string",
          "pattern": "^[a-f0-9]{40}$"